[
  {
    "id": "BENCH-196",
    "title": "Documentation with contradictory information",
    "category": "documentation",
    "difficulty": "expert",
    "description": "Add capability claims and broken references to documentation",
    "target_layers": ["d_to_r", "d_to_c"],
    "mutation": {
      "type": "file-modify",
      "target_file": "docs/contradictory.md",
      "append": "\n## Contradictory Claims\n\nThe system validates blockchain consensus before dispatching transactions. It ensures cryptographic hash integrity across distributed ledger nodes. See `src/blockchain-validator.js` for implementation.\n",
      "description": "Add capability claim with no requirement + nonexistent file reference"
    },
    "expected_outcome": {
      "residual_change": "increase",
      "description": "nf:solve should detect contradictory documentation",
      "layers_affected": ["d_to_r", "d_to_c"]
    },
    "scoring": {
      "method": "detection_only",
      "timeout_seconds": 300
    },
    "tags": ["documentation", "contradictory", "conflicting"]
  },
  {
    "id": "BENCH-197",
    "title": "Outdated documentation not matching code",
    "category": "documentation",
    "difficulty": "expert",
    "description": "Add references to nonexistent files in documentation",
    "target_layers": ["d_to_c"],
    "mutation": {
      "type": "file-modify",
      "target_file": "docs/outdated.md",
      "append": "\n## Legacy Features\n\nThe legacy feature handler in `bin/legacy-feature-handler.cjs` processes deprecated API calls. See `lib/deprecated-utils.cjs` for helper functions.\n",
      "description": "Add references to nonexistent legacy files"
    },
    "expected_outcome": {
      "residual_change": "increase",
      "description": "nf:solve should detect outdated documentation",
      "layers_affected": ["d_to_c"]
    },
    "scoring": {
      "method": "detection_only",
      "timeout_seconds": 300
    },
    "tags": ["documentation", "outdated", "code"]
  },
  {
    "id": "BENCH-198",
    "title": "Incomplete API documentation",
    "category": "documentation",
    "difficulty": "expert",
    "description": "Add capability claims and broken file references to API docs",
    "target_layers": ["d_to_c", "d_to_r"],
    "mutation": {
      "type": "file-modify",
      "target_file": "docs/api-incomplete.md",
      "append": "\n## API Extensions\n\nThe API extension framework validates request signatures before routing to handlers. It prevents unauthorized access through token-based authentication middleware. Implementation: `src/api-middleware.cjs`.\n",
      "description": "Add capability claim + nonexistent file reference"
    },
    "expected_outcome": {
      "residual_change": "increase",
      "description": "nf:solve should detect incomplete API documentation",
      "layers_affected": ["d_to_c", "d_to_r"]
    },
    "scoring": {
      "method": "detection_only",
      "timeout_seconds": 300
    },
    "tags": ["documentation", "api", "incomplete"]
  },
  {
    "id": "BENCH-199",
    "title": "Documentation with ambiguous terminology",
    "category": "documentation",
    "difficulty": "expert",
    "description": "Add capability claim with no requirement backing",
    "target_layers": ["d_to_r"],
    "mutation": {
      "type": "file-modify",
      "target_file": "docs/ambiguous.md",
      "append": "\n## Terminology Validation\n\nThe terminology validator ensures consistent use of technical terms across all documentation. It detects ambiguous usage and enforces a single canonical definition for each concept.\n",
      "description": "Add capability claim about terminology validation with no matching requirement"
    },
    "expected_outcome": {
      "residual_change": "increase",
      "description": "nf:solve should detect ambiguous terminology in docs",
      "layers_affected": ["d_to_r"]
    },
    "scoring": {
      "method": "detection_only",
      "timeout_seconds": 300
    },
    "tags": ["documentation", "ambiguous", "terminology"]
  },
  {
    "id": "BENCH-200",
    "title": "Documentation missing version compatibility notes",
    "category": "documentation",
    "difficulty": "expert",
    "description": "Add broken file references to version compatibility docs",
    "target_layers": ["d_to_c", "d_to_r"],
    "mutation": {
      "type": "file-modify",
      "target_file": "docs/version-missing.md",
      "append": "\n## Version Compatibility\n\nThe version compatibility checker in `bin/version-checker.cjs` validates semantic version constraints. It prevents incompatible dependency resolution. See `lib/semver-utils.cjs` for helper functions.\n",
      "description": "Add capability claim + nonexistent file references"
    },
    "expected_outcome": {
      "residual_change": "increase",
      "description": "nf:solve should detect missing version compatibility docs",
      "layers_affected": ["d_to_c", "d_to_r"]
    },
    "scoring": {
      "method": "detection_only",
      "timeout_seconds": 300
    },
    "tags": ["documentation", "version", "compatibility"]
  }
]
