[
  {
    "id": "BENCH-131",
    "title": "Untraced regularization-tuner utility (C->R)",
    "category": "code",
    "difficulty": "expert",
    "description": "Add a model regularization tuner in bin/ with no @req traceability",
    "target_layers": [
      "c_to_r"
    ],
    "mutation": {
      "type": "file-create",
      "target_file": "bin/rf-regularization-tuner.cjs",
      "content": "'use strict';\nfunction overfitGap(trainScore, valScore) {\n  return trainScore - valScore;\n}\nfunction suggestLambda(gap) {\n  if (gap > 0.2) return 0.1;\n  if (gap > 0.1) return 0.01;\n  return 0.001;\n}\nmodule.exports = { overfitGap, suggestLambda };\n",
      "description": "Create regularization-tuner utility with no requirement tracing"
    },
    "expected_outcome": {
      "residual_change": "increase",
      "description": "C->R candidate: untraced code symbol with no requirement link",
      "layers_affected": [
        "c_to_r"
      ]
    },
    "scoring": {
      "method": "detection_only",
      "timeout_seconds": 300
    },
    "tags": [
      "ai-ml",
      "c_to_r",
      "code"
    ]
  },
  {
    "id": "BENCH-132",
    "title": "Untraced sample-screener utility (C->R)",
    "category": "integration",
    "difficulty": "expert",
    "description": "Add a training-sample screener in bin/ with no @req traceability",
    "target_layers": [
      "c_to_r"
    ],
    "mutation": {
      "type": "file-create",
      "target_file": "bin/rf-sample-screener.cjs",
      "content": "'use strict';\nfunction screenSample(sample, bounds) {\n  return Object.keys(bounds).every((key) => {\n    const v = sample[key];\n    return typeof v === 'number' && v >= bounds[key][0] && v <= bounds[key][1];\n  });\n}\nmodule.exports = { screenSample };\n",
      "description": "Create sample-screener utility with no requirement tracing"
    },
    "expected_outcome": {
      "residual_change": "increase",
      "description": "C->R candidate: untraced code symbol with no requirement link",
      "layers_affected": [
        "c_to_r"
      ]
    },
    "scoring": {
      "method": "detection_only",
      "timeout_seconds": 300
    },
    "tags": [
      "ai-ml",
      "c_to_r",
      "code"
    ]
  },
  {
    "id": "BENCH-133",
    "title": "Untraced split-validator utility (C->R)",
    "category": "code",
    "difficulty": "expert",
    "description": "Add a train/test split leakage validator in bin/ with no @req traceability",
    "target_layers": [
      "c_to_r"
    ],
    "mutation": {
      "type": "file-create",
      "target_file": "bin/rf-split-validator.cjs",
      "content": "'use strict';\nfunction hasLeakage(trainIds, testIds) {\n  const train = new Set(trainIds);\n  return testIds.some((id) => train.has(id));\n}\nfunction overlapCount(trainIds, testIds) {\n  const train = new Set(trainIds);\n  return testIds.filter((id) => train.has(id)).length;\n}\nmodule.exports = { hasLeakage, overlapCount };\n",
      "description": "Create split-validator utility with no requirement tracing"
    },
    "expected_outcome": {
      "residual_change": "increase",
      "description": "C->R candidate: untraced code symbol with no requirement link",
      "layers_affected": [
        "c_to_r"
      ]
    },
    "scoring": {
      "method": "detection_only",
      "timeout_seconds": 300
    },
    "tags": [
      "ai-ml",
      "c_to_r",
      "code"
    ]
  },
  {
    "id": "BENCH-134",
    "title": "Untraced inference-monitor utility (C->R)",
    "category": "integration",
    "difficulty": "expert",
    "description": "Add a model inference monitor in bin/ with no @req traceability",
    "target_layers": [
      "c_to_r"
    ],
    "mutation": {
      "type": "file-create",
      "target_file": "bin/rf-inference-monitor.cjs",
      "content": "'use strict';\nfunction recordPrediction(stats, latencyMs, confidence) {\n  stats.count = (stats.count || 0) + 1;\n  stats.totalLatency = (stats.totalLatency || 0) + latencyMs;\n  stats.lowConfidence = (stats.lowConfidence || 0) + (confidence < 0.5 ? 1 : 0);\n  return stats;\n}\nfunction avgLatency(stats) {\n  return stats.count ? stats.totalLatency / stats.count : 0;\n}\nmodule.exports = { recordPrediction, avgLatency };\n",
      "description": "Create inference-monitor utility with no requirement tracing"
    },
    "expected_outcome": {
      "residual_change": "increase",
      "description": "C->R candidate: untraced code symbol with no requirement link",
      "layers_affected": [
        "c_to_r"
      ]
    },
    "scoring": {
      "method": "detection_only",
      "timeout_seconds": 300
    },
    "tags": [
      "ai-ml",
      "c_to_r",
      "code"
    ]
  },
  {
    "id": "BENCH-135",
    "title": "Untraced fairness-auditor utility (C->R)",
    "category": "formal-models",
    "difficulty": "expert",
    "description": "Add a training-data fairness auditor in bin/ with no @req traceability",
    "target_layers": [
      "c_to_r"
    ],
    "mutation": {
      "type": "file-create",
      "target_file": "bin/rf-fairness-auditor.cjs",
      "content": "'use strict';\nfunction groupCounts(samples, attr) {\n  const counts = {};\n  for (const s of samples) counts[s[attr]] = (counts[s[attr]] || 0) + 1;\n  return counts;\n}\nfunction imbalanceRatio(counts) {\n  const vals = Object.values(counts);\n  if (!vals.length) return 0;\n  return Math.max(...vals) / Math.min(...vals);\n}\nmodule.exports = { groupCounts, imbalanceRatio };\n",
      "description": "Create fairness-auditor utility with no requirement tracing"
    },
    "expected_outcome": {
      "residual_change": "increase",
      "description": "C->R candidate: untraced code symbol with no requirement link",
      "layers_affected": [
        "c_to_r"
      ]
    },
    "scoring": {
      "method": "detection_only",
      "timeout_seconds": 300
    },
    "tags": [
      "ai-ml",
      "c_to_r",
      "code"
    ]
  }
]
