[
  {
    "id": "BENCH-201",
    "title": "Untraced auth-flow-tracker utility (C->R)",
    "category": "integration",
    "difficulty": "expert",
    "description": "Add an authentication flow tracker in bin/ with no @req traceability",
    "target_layers": [
      "c_to_r"
    ],
    "mutation": {
      "type": "file-create",
      "target_file": "bin/rf-auth-flow-tracker.cjs",
      "content": "'use strict';\nconst STEPS = ['credentials', 'mfa', 'session'];\nfunction nextStep(current) {\n  const idx = STEPS.indexOf(current);\n  return idx >= 0 && idx < STEPS.length - 1 ? STEPS[idx + 1] : null;\n}\nfunction isComplete(current) {\n  return current === STEPS[STEPS.length - 1];\n}\nmodule.exports = { nextStep, isComplete, STEPS };\n",
      "description": "Create auth-flow-tracker utility with no requirement tracing"
    },
    "expected_outcome": {
      "residual_change": "increase",
      "description": "C->R candidate: untraced code symbol with no requirement link",
      "layers_affected": [
        "c_to_r"
      ]
    },
    "scoring": {
      "method": "detection_only",
      "timeout_seconds": 300
    },
    "tags": [
      "end-to-end",
      "c_to_r",
      "code"
    ]
  },
  {
    "id": "BENCH-202",
    "title": "Untraced checkout-orchestrator utility (C->R)",
    "category": "integration",
    "difficulty": "expert",
    "description": "Add an e-commerce checkout orchestrator in bin/ with no @req traceability",
    "target_layers": [
      "c_to_r"
    ],
    "mutation": {
      "type": "file-create",
      "target_file": "bin/rf-checkout-orchestrator.cjs",
      "content": "'use strict';\nfunction orderTotal(items, taxRate) {\n  const subtotal = items.reduce((s, i) => s + i.price * i.qty, 0);\n  return subtotal + subtotal * (taxRate || 0);\n}\nfunction canCheckout(cart) {\n  return Array.isArray(cart.items) && cart.items.length > 0 && Boolean(cart.payment);\n}\nmodule.exports = { orderTotal, canCheckout };\n",
      "description": "Create checkout-orchestrator utility with no requirement tracing"
    },
    "expected_outcome": {
      "residual_change": "increase",
      "description": "C->R candidate: untraced code symbol with no requirement link",
      "layers_affected": [
        "c_to_r"
      ]
    },
    "scoring": {
      "method": "detection_only",
      "timeout_seconds": 300
    },
    "tags": [
      "end-to-end",
      "c_to_r",
      "code"
    ]
  },
  {
    "id": "BENCH-203",
    "title": "Untraced milestone-progressor utility (C->R)",
    "category": "convergence",
    "difficulty": "expert",
    "description": "Add a progressive milestone progressor in bin/ with no @req traceability",
    "target_layers": [
      "c_to_r"
    ],
    "mutation": {
      "type": "file-create",
      "target_file": "bin/rf-milestone-progressor.cjs",
      "content": "'use strict';\nfunction progressPercent(completed, total) {\n  return total > 0 ? Math.round((completed / total) * 100) : 0;\n}\nfunction currentTier(percent) {\n  if (percent >= 100) return 'advanced';\n  if (percent >= 50) return 'intermediate';\n  return 'basic';\n}\nmodule.exports = { progressPercent, currentTier };\n",
      "description": "Create milestone-progressor utility with no requirement tracing"
    },
    "expected_outcome": {
      "residual_change": "increase",
      "description": "C->R candidate: untraced code symbol with no requirement link",
      "layers_affected": [
        "c_to_r"
      ]
    },
    "scoring": {
      "method": "detection_only",
      "timeout_seconds": 300
    },
    "tags": [
      "end-to-end",
      "c_to_r",
      "code"
    ]
  },
  {
    "id": "BENCH-204",
    "title": "Untraced gateway-router utility (C->R)",
    "category": "integration",
    "difficulty": "expert",
    "description": "Add an API gateway router in bin/ with no @req traceability",
    "target_layers": [
      "c_to_r"
    ],
    "mutation": {
      "type": "file-create",
      "target_file": "bin/rf-gateway-router.cjs",
      "content": "'use strict';\nfunction matchRoute(routes, method, pathName) {\n  return routes.find((r) => r.method === method && r.path === pathName) || null;\n}\nfunction routeKey(method, pathName) {\n  return method.toUpperCase() + ' ' + pathName;\n}\nmodule.exports = { matchRoute, routeKey };\n",
      "description": "Create gateway-router utility with no requirement tracing"
    },
    "expected_outcome": {
      "residual_change": "increase",
      "description": "C->R candidate: untraced code symbol with no requirement link",
      "layers_affected": [
        "c_to_r"
      ]
    },
    "scoring": {
      "method": "detection_only",
      "timeout_seconds": 300
    },
    "tags": [
      "end-to-end",
      "c_to_r",
      "code"
    ]
  },
  {
    "id": "BENCH-205",
    "title": "Untraced integration-coordinator utility (C->R)",
    "category": "integration",
    "difficulty": "expert",
    "description": "Add a cross-team integration coordinator in bin/ with no @req traceability",
    "target_layers": [
      "c_to_r"
    ],
    "mutation": {
      "type": "file-create",
      "target_file": "bin/rf-integration-coordinator.cjs",
      "content": "'use strict';\nfunction mergeContracts(contracts) {\n  const merged = {};\n  for (const c of contracts) {\n    for (const key of Object.keys(c || {})) merged[key] = c[key];\n  }\n  return merged;\n}\nfunction missingDependencies(provided, required) {\n  return required.filter((dep) => !provided.includes(dep));\n}\nmodule.exports = { mergeContracts, missingDependencies };\n",
      "description": "Create integration-coordinator utility with no requirement tracing"
    },
    "expected_outcome": {
      "residual_change": "increase",
      "description": "C->R candidate: untraced code symbol with no requirement link",
      "layers_affected": [
        "c_to_r"
      ]
    },
    "scoring": {
      "method": "detection_only",
      "timeout_seconds": 300
    },
    "tags": [
      "end-to-end",
      "c_to_r",
      "code"
    ]
  }
]
